{
  "contract_name": "supervisor.task.proposal",
  "contract_version": "1.0.0",
  "schema_version": "1.0.0",
  "taxonomy_version": "taxonomy-reason-v1",
  "tenant_id": "tenant-lab-001",
  "customer_context_id": "customer-context-main",
  "environment": "phase0_lab",
  "correlation_id": "corr-task-proposal-001",
  "causation_id": "helper-result-001",
  "idempotency_key": "idem-task-proposal-001-r1",
  "producer": {"component": "supervisor", "produced_at": "2026-09-07T16:00:00Z"},
  "policy_version": "policy-supervisor-task-proposal-lab-v1",
  "proposal_id": "task-proposal-001",
  "revision": 1,
  "state": "draft",
  "transition_reason_codes": ["task_proposal_created"],
  "source_helper_result_id": "helper-result-001",
  "scenario_id": "missing-phone",
  "task_class": "form_preparation",
  "priority": "normal",
  "selected_step_ids": ["review_synthetic_scenario", "resolve_human_input_fields", "owner_review_prepared_form"],
  "issue_fields": ["phone"],
  "human_input_required": true,
  "owner_decision": "none",
  "guardian_decision_id": "gd-task-proposal-001",
  "pre_action_evidence_ref": "harness-event:task-proposal-pre-001",
  "post_action_evidence_ref": "harness-event:task-proposal-post-001",
  "synthetic_data_only": true,
  "free_form_content_allowed": false,
  "approval_required_for_future_execution": true,
  "approval_token_issued": false,
  "assigned_worker_id": null,
  "arc_dispatch_allowed": false,
  "arc_dispatched": false,
  "model_called": false,
  "tools_used": false,
  "connector_accessed": false,
  "submission_allowed": false,
  "external_side_effects": false,
  "created_at": "2026-09-07T16:00:00Z",
  "updated_at": "2026-09-07T16:00:00Z"
}
